smartctl 7.1 2019-12-30 r5022 [x86_64-linux-5.13.0-7620-generic] (local build)
Copyright (C) 2002-19, Bruce Allen, Christian Franke, www.smartmontools.org

=== START OF INFORMATION SECTION ===
Model Family:     Phison Driven SSDs
Device Model:     KINGSTON SA400S37240G
Serial Number:    50026B778201DF80
LU WWN Device Id: 5 0026b7 78201df80
Firmware Version: SBFK71B1
User Capacity:    240,057,409,536 bytes [240 GB]
Sector Size:      512 bytes logical/physical
Rotation Rate:    Solid State Device
Device is:        In smartctl database [for details use: -P show]
ATA Version is:   ACS-3 T13/2161-D revision 4
SATA Version is:  SATA 3.2, 6.0 Gb/s (current: 6.0 Gb/s)
Local Time is:    Sat Nov 20 15:44:14 2021 -05
SMART support is: Available - device has SMART capability.
SMART support is: Enabled

=== START OF READ SMART DATA SECTION ===
SMART Status not supported: Incomplete response, ATA output registers missing
SMART overall-health self-assessment test result: PASSED
Warning: This result is based on an Attribute check.

General SMART Values:
Offline data collection status:  (0x00)	Offline data collection activity
					was never started.
					Auto Offline Data Collection: Disabled.
Total time to complete Offline 
data collection: 		(65535) seconds.
Offline data collection
capabilities: 			 (0x00) 	Offline data collection not supported.
SMART capabilities:            (0x0003)	Saves SMART data before entering
					power-saving mode.
					Supports SMART auto save timer.
Error logging capability:        (0x01)	Error logging supported.
					General Purpose Logging supported.

SMART Attributes Data Structure revision number: 16
Vendor Specific SMART Attributes with Thresholds:
ID# ATTRIBUTE_NAME          FLAG     VALUE WORST THRESH TYPE      UPDATED  WHEN_FAILED RAW_VALUE
  1 Raw_Read_Error_Rate     0x0032   099   099   000    Old_age   Always       -       8923
  9 Power_On_Hours          0x0032   100   100   000    Old_age   Always       -       1194
 12 Power_Cycle_Count       0x0032   100   100   000    Old_age   Always       -       1991
148 Unknown_Attribute       0x0000   255   255   000    Old_age   Offline      -       529
149 Unknown_Attribute       0x0000   255   255   000    Old_age   Offline      -       1461
167 Write_Protect_Mode      0x0000   100   100   000    Old_age   Offline      -       0
168 SATA_Phy_Error_Count    0x0012   100   100   000    Old_age   Always       -       0
169 Bad_Block_Rate          0x0000   100   100   000    Old_age   Offline      -       52
170 Bad_Blk_Ct_Erl/Lat      0x0000   100   100   010    Old_age   Offline      -       0/11
172 Erase_Fail_Count        0x0032   100   100   000    Old_age   Always       -       0
173 MaxAvgErase_Ct          0x0000   100   100   000    Old_age   Offline      -       96 (Average 41)
181 Program_Fail_Count      0x0032   100   100   000    Old_age   Always       -       0
182 Erase_Fail_Count        0x0000   255   255   000    Old_age   Offline      -       106
187 Reported_Uncorrect      0x0032   100   100   000    Old_age   Always       -       40
192 Unsafe_Shutdown_Count   0x0012   100   100   000    Old_age   Always       -       41
194 Temperature_Celsius     0x0022   071   057   000    Old_age   Always       -       29 (Min/Max 16/43)
196 Reallocated_Event_Count 0x0000   100   100   000    Old_age   Offline      -       135
199 SATA_CRC_Error_Count    0x0032   100   100   000    Old_age   Always       -       0
218 CRC_Error_Count         0x0000   100   100   000    Old_age   Offline      -       0
231 SSD_Life_Left           0x0013   100   100   000    Pre-fail  Always       -       95
233 Flash_Writes_GiB        0x0013   100   100   000    Pre-fail  Always       -       11382
241 Lifetime_Writes_GiB     0x0012   100   100   000    Old_age   Always       -       5449
242 Lifetime_Reads_GiB      0x0012   100   100   000    Old_age   Always       -       7369
244 Average_Erase_Count     0x0000   100   100   000    Old_age   Offline      -       41
245 Max_Erase_Count         0x0000   100   100   000    Old_age   Offline      -       96
246 Total_Erase_Count       0x0000   100   100   000    Old_age   Offline      -       426520

SMART Error Log Version: 1
No Errors Logged

SMART Self-test log structure revision number 1
No self-tests have been logged.  [To run self-tests, use: smartctl -t]

Selective Self-tests/Logging not supported

